song_name,song_release,song_artist,listen_time
Cannonball,Weekend Songs,Damien Rice,1
Sincerité Et Jalousie,Simple Et Funky,Alliance Ethnik,1
Luvstruck,Hard House Anthems,Southside Spinners,5
Hey_ Soul Sister,Save Me_ San Francisco,Train,1
Leave Right Now,Fridays Child,Will Young,1
I Wanna Rock the Place,Everybody Dance Now,Crazy Frog,1
Let Me Be Myself,3 Doors Down,3 Doors Down,1
Unwell (Album Version),More Than You Think You Are,matchbox twenty,1
I Thought It Was You,Swept,Julia Fordham,6
Liquid Confidence,Hold Me Down,You Me At Six,1
I?'m A Steady Rollin? Man,Diggin' Deeper Volume 7,Robert Johnson,7
Why Georgia,Where The Light Is: John Mayer Live In Los Angeles,John Mayer,1
All We Ever Do Is Say Goodbye,Battle Studies,John Mayer,1
Rianna,The Update Collection Vol. 2,Fisher,2
Twenty-Two,Twenty-Two (Single),Wakey!Wakey!,1
Who Am I,Keep On,Will Young,8
Breakdown (Album Version),Tom Petty & The Heartbreakers,Tom Petty And The Heartbreakers,3
Ftes,To Pathos Ine Aformi,Peggy Zina,6
The Klan,M.O.R,Alabama 3,8
The Remedy (I Won't Worry) (New EQ'd LP Version),The Remedy [I Won't Worry],Jason Mraz,1
Marry Me,Save Me_ San Francisco,Train,3
My Sacrifice,Greatest Hits,Creed,2
Where I've Alwayz Been,Bipolar,Darc Mind,5
Car Crash,Almost Everything I Wish I'd Said The Last Time I Saw You...,Wakey!Wakey!,1
Mountains,Mountains,Biffy Clyro,1
