song_name,song_release,song_artist,listen_time
Rocket In The Sky ,Rocket in the sky - Single,Benassi Bros. Feat. Dhany,5
Lola's Theme (Main Mix),Lola's Theme,The Shapeshifters,1
Loneliness,Euphoria: A Decade of Trance Anthems,Tomcraft,4
Need To Feel Loved,Godskitchen Pure Trance Anthems,Reflekt ft. Delline Bass,2
Tell Me Why,The Best Of Data Records ,Supermode,6
Easy Love,The Looks,MSTRKRFT,2
Bulletproof,Bulletproof,La Roux,3
Better Day,GU Mixed 3,Dirty South & Paul Harris Feat. Rudy,6
Brazil,Random Album Title ,Deadmau5,2
That's My Name (Album Version),That's My Name,Akcent,2
If I Can't Have You,UltraSex,Mount Sims,2
Raining Again (Steve Angello's Vocal Mix),Hotel: The Remixes,Moby,16
Surround,American Hi-Fi,American Hi-Fi,5
Angel On My Shoulder (EDX Radio Edit),Angel On My Shoulder,Kaskade,2
